{
  "$schema": "https://json-schema.org/draft/2020-12/schema",
  "$id": "oan.hopng_phase_slice.v0.1.0.json",
  "title": "HOPNG Phase Slice Set",
  "type": "object",
  "required": ["schema", "schemaVersion", "artifactId", "slices"],
  "properties": {
    "schema": { "const": "oan.hopng_phase_slice" },
    "schemaVersion": { "const": "0.1.0" },
    "artifactId": { "type": "string" },
    "slices": {
      "type": "array",
      "minItems": 1
    }
  }
}
