{"artifactId":"c8a81129-2a59-43c9-8332-b7af4085f5aa","schema":"oan.hopng_phase_slice","schemaVersion":"0.1.0","slices":[{"artifactId":"c8a81129-2a59-43c9-8332-b7af4085f5aa","deltaHorizon":20,"deltaHorizonMs":20000,"n":0,"phaseSliceId":"phase-1","sliceDigest":"03aa6816870e69c3dacd5b65f009306c5c07b1b92990681f3caa758e413b459d","sourceEventSliceIds":["event-0","event-1"],"sourceRawEndN":19,"sourceRawStartN":0,"timestampEndUtc":"2026-03-07T00:00:20\u002B00:00","timestampStartUtc":"2026-03-07T00:00:00\u002B00:00","universeStates":{"cryptic-support":{"bloom":0.4,"drift":-0.1,"pressure":0.2},"prime-projection":{"bloom":0.7,"drift":0.19999999999999998,"pressure":0.325}}},{"artifactId":"c8a81129-2a59-43c9-8332-b7af4085f5aa","deltaHorizon":20,"deltaHorizonMs":20000,"n":1,"phaseSliceId":"phase-2","sliceDigest":"8e43d0aff0c51ba7e025d36107dd87b54b81735fbac45187c93bf499e569342d","sourceEventSliceIds":["event-1","event-2"],"sourceRawEndN":29,"sourceRawStartN":10,"timestampEndUtc":"2026-03-07T00:00:30\u002B00:00","timestampStartUtc":"2026-03-07T00:00:10\u002B00:00","universeStates":{"cryptic-support":{"bloom":0.65,"drift":0.19999999999999998,"pressure":0.25},"prime-projection":{"bloom":0.9,"drift":0.04999999999999999,"pressure":0.475}}},{"artifactId":"c8a81129-2a59-43c9-8332-b7af4085f5aa","deltaHorizon":20,"deltaHorizonMs":20000,"n":2,"phaseSliceId":"phase-3","sliceDigest":"75cd342eebe5516550c7493d39ed5275c33a533d06beffb20fd34da19e528740","sourceEventSliceIds":["event-2","event-3"],"sourceRawEndN":39,"sourceRawStartN":20,"timestampEndUtc":"2026-03-07T00:00:40\u002B00:00","timestampStartUtc":"2026-03-07T00:00:20\u002B00:00","universeStates":{"cryptic-support":{"bloom":0.85,"drift":0.2,"pressure":0.47500000000000003},"prime-projection":{"bloom":0.8,"drift":0.10000000000000003,"pressure":0.45999999999999996}}}]}