{"artifactId":"29dc4597-875d-4c39-892d-f9f0e90abb8e","schema":"oan.hopng_phase_slice","schemaVersion":"0.1.0","slices":[{"artifactId":"29dc4597-875d-4c39-892d-f9f0e90abb8e","deltaHorizon":20,"deltaHorizonMs":20000,"n":0,"phaseSliceId":"phase-1","sliceDigest":"e2570dbb113eb50b75333c1f4504a6658c00bd6dee7f8fb74b7a31bcadfeec9c","sourceEventSliceIds":["event-0","event-1"],"sourceRawEndN":19,"sourceRawStartN":0,"timestampEndUtc":"2026-03-07T00:00:20\u002B00:00","timestampStartUtc":"2026-03-07T00:00:00\u002B00:00","universeStates":{"cryptic-support":{"bloom":0.4,"drift":-0.1,"pressure":0.2},"prime-projection":{"bloom":0.7,"drift":0.19999999999999998,"pressure":0.325}}},{"artifactId":"29dc4597-875d-4c39-892d-f9f0e90abb8e","deltaHorizon":20,"deltaHorizonMs":20000,"n":1,"phaseSliceId":"phase-2","sliceDigest":"004f7a598e675eb0b957bb158c75993f12eefcfb1006e72ecefe6cb0ca5d28dd","sourceEventSliceIds":["event-1","event-2"],"sourceRawEndN":29,"sourceRawStartN":10,"timestampEndUtc":"2026-03-07T00:00:30\u002B00:00","timestampStartUtc":"2026-03-07T00:00:10\u002B00:00","universeStates":{"cryptic-support":{"bloom":0.65,"drift":0.19999999999999998,"pressure":0.25},"prime-projection":{"bloom":0.9,"drift":0.04999999999999999,"pressure":0.475}}},{"artifactId":"29dc4597-875d-4c39-892d-f9f0e90abb8e","deltaHorizon":20,"deltaHorizonMs":20000,"n":2,"phaseSliceId":"phase-3","sliceDigest":"41307bbf72dca2aeae8cc7ccfb6b0414aec2b9fb214d03d67aa610e0fe210cf4","sourceEventSliceIds":["event-2","event-3"],"sourceRawEndN":39,"sourceRawStartN":20,"timestampEndUtc":"2026-03-07T00:00:40\u002B00:00","timestampStartUtc":"2026-03-07T00:00:20\u002B00:00","universeStates":{"cryptic-support":{"bloom":0.8,"drift":0.10000000000000003,"pressure":0.47500000000000003},"prime-projection":{"bloom":0.6,"drift":-0.19999999999999998,"pressure":0.44}}}]}