{"artifactId":"c7f83255-d629-476f-9ce4-6228aaf71b83","schema":"oan.hopng_phase_slice","schemaVersion":"0.1.0","slices":[{"artifactId":"c7f83255-d629-476f-9ce4-6228aaf71b83","deltaHorizon":20,"deltaHorizonMs":20000,"n":0,"phaseSliceId":"phase-1","sliceDigest":"1afd63c271ed253a3bf3ec6085993ccbdcee81d6e88a842d5790e83c26be26a3","sourceEventSliceIds":["event-0","event-1"],"sourceRawEndN":19,"sourceRawStartN":0,"timestampEndUtc":"2026-03-07T00:00:20\u002B00:00","timestampStartUtc":"2026-03-07T00:00:00\u002B00:00","universeStates":{"cryptic-support":{"bloom":0.4,"drift":-0.1,"pressure":0.2},"prime-projection":{"bloom":0.7,"drift":0.19999999999999998,"pressure":0.325}}},{"artifactId":"c7f83255-d629-476f-9ce4-6228aaf71b83","deltaHorizon":20,"deltaHorizonMs":20000,"n":1,"phaseSliceId":"phase-2","sliceDigest":"3c36dd88d9b4f41f90016ace0a6a2e85356df5008e24a13199ec1a9d0fdfab8b","sourceEventSliceIds":["event-1","event-2"],"sourceRawEndN":29,"sourceRawStartN":10,"timestampEndUtc":"2026-03-07T00:00:30\u002B00:00","timestampStartUtc":"2026-03-07T00:00:10\u002B00:00","universeStates":{"cryptic-support":{"bloom":0.65,"drift":0.19999999999999998,"pressure":0.25},"prime-projection":{"bloom":0.9,"drift":0.04999999999999999,"pressure":0.475}}},{"artifactId":"c7f83255-d629-476f-9ce4-6228aaf71b83","deltaHorizon":20,"deltaHorizonMs":20000,"n":2,"phaseSliceId":"phase-3","sliceDigest":"0f7f29ef03fa39e2fc6278c044631da4f37e7f55e7915e738c357a59ff648901","sourceEventSliceIds":["event-2","event-3"],"sourceRawEndN":39,"sourceRawStartN":20,"timestampEndUtc":"2026-03-07T00:00:40\u002B00:00","timestampStartUtc":"2026-03-07T00:00:20\u002B00:00","universeStates":{"cryptic-support":{"bloom":0.8,"drift":0.10000000000000003,"pressure":0.47500000000000003},"prime-projection":{"bloom":0.6,"drift":-0.19999999999999998,"pressure":0.44}}}]}