{"artifactId":"7eb86bd1-6a4c-48f1-bc1a-2266bff533ea","schema":"oan.hopng_phase_slice","schemaVersion":"0.1.0","slices":[{"artifactId":"7eb86bd1-6a4c-48f1-bc1a-2266bff533ea","deltaHorizon":20,"deltaHorizonMs":20000,"n":0,"phaseSliceId":"phase-1","sliceDigest":"4ee8ff3054623cb63f1f83978b51994db61f380c84f6334de987bb5ea32dfa04","sourceEventSliceIds":["event-0","event-1"],"sourceRawEndN":19,"sourceRawStartN":0,"timestampEndUtc":"2026-03-07T00:00:20\u002B00:00","timestampStartUtc":"2026-03-07T00:00:00\u002B00:00","universeStates":{"cryptic-support":{"bloom":0.4,"drift":-0.1,"pressure":0.2},"prime-projection":{"bloom":0.7,"drift":0.19999999999999998,"pressure":0.325}}},{"artifactId":"7eb86bd1-6a4c-48f1-bc1a-2266bff533ea","deltaHorizon":20,"deltaHorizonMs":20000,"n":1,"phaseSliceId":"phase-2","sliceDigest":"e09c0c4b96f964880184ec760933ecc86585e8b6a2b88f2075ebe9e734fffbd3","sourceEventSliceIds":["event-1","event-2"],"sourceRawEndN":29,"sourceRawStartN":10,"timestampEndUtc":"2026-03-07T00:00:30\u002B00:00","timestampStartUtc":"2026-03-07T00:00:10\u002B00:00","universeStates":{"cryptic-support":{"bloom":0.65,"drift":0.19999999999999998,"pressure":0.25},"prime-projection":{"bloom":0.9,"drift":0.04999999999999999,"pressure":0.475}}},{"artifactId":"7eb86bd1-6a4c-48f1-bc1a-2266bff533ea","deltaHorizon":20,"deltaHorizonMs":20000,"n":2,"phaseSliceId":"phase-3","sliceDigest":"27de9401768bd771f994a292a4dc25c6949849293dadee94d2a05ecc58e195fa","sourceEventSliceIds":["event-2","event-3"],"sourceRawEndN":39,"sourceRawStartN":20,"timestampEndUtc":"2026-03-07T00:00:40\u002B00:00","timestampStartUtc":"2026-03-07T00:00:20\u002B00:00","universeStates":{"cryptic-support":{"bloom":0.8,"drift":0.10000000000000003,"pressure":0.47500000000000003},"prime-projection":{"bloom":0.6,"drift":-0.19999999999999998,"pressure":0.44}}}]}