{"artifactId":"71ee9640-daa7-4abd-8980-83bc53607f14","schema":"oan.hopng_phase_slice","schemaVersion":"0.1.0","slices":[{"artifactId":"71ee9640-daa7-4abd-8980-83bc53607f14","deltaHorizon":20,"deltaHorizonMs":20000,"n":0,"phaseSliceId":"phase-1","sliceDigest":"dfe6433cbcfb3794ed7da75752503bb9a82d4a02b01e3c907f749d8d22647286","sourceEventSliceIds":["event-0","event-1"],"sourceRawEndN":19,"sourceRawStartN":0,"timestampEndUtc":"2026-03-07T00:00:20\u002B00:00","timestampStartUtc":"2026-03-07T00:00:00\u002B00:00","universeStates":{"cryptic-support":{"bloom":0.4,"drift":-0.1,"pressure":0.2},"prime-projection":{"bloom":0.7,"drift":0.19999999999999998,"pressure":0.325}}},{"artifactId":"71ee9640-daa7-4abd-8980-83bc53607f14","deltaHorizon":20,"deltaHorizonMs":20000,"n":1,"phaseSliceId":"phase-2","sliceDigest":"76e3548217332a5a81eaca4eceb05837d9db12600bdeccfa4e9cc09600114497","sourceEventSliceIds":["event-1","event-2"],"sourceRawEndN":29,"sourceRawStartN":10,"timestampEndUtc":"2026-03-07T00:00:30\u002B00:00","timestampStartUtc":"2026-03-07T00:00:10\u002B00:00","universeStates":{"cryptic-support":{"bloom":0.65,"drift":0.19999999999999998,"pressure":0.25},"prime-projection":{"bloom":0.9,"drift":0.04999999999999999,"pressure":0.475}}},{"artifactId":"71ee9640-daa7-4abd-8980-83bc53607f14","deltaHorizon":20,"deltaHorizonMs":20000,"n":2,"phaseSliceId":"phase-3","sliceDigest":"f9ee8ed1b29fe62d961d8d8ce2b8c69106b4a90b93f2e10a35352f0e4752c9a3","sourceEventSliceIds":["event-2","event-3"],"sourceRawEndN":39,"sourceRawStartN":20,"timestampEndUtc":"2026-03-07T00:00:40\u002B00:00","timestampStartUtc":"2026-03-07T00:00:20\u002B00:00","universeStates":{"cryptic-support":{"bloom":0.8,"drift":0.10000000000000003,"pressure":0.47500000000000003},"prime-projection":{"bloom":0.6,"drift":-0.19999999999999998,"pressure":0.44}}}]}