{"artifactId":"f196120c-0fed-4d44-944c-0da60949710a","schema":"oan.hopng_phase_slice","schemaVersion":"0.1.0","slices":[{"artifactId":"f196120c-0fed-4d44-944c-0da60949710a","deltaHorizon":20,"deltaHorizonMs":20000,"n":0,"phaseSliceId":"phase-1","sliceDigest":"ab8bbae41fac48a362e1dc3b0326fee803537ec54e042fc47d836b89427ca4dc","sourceEventSliceIds":["event-0","event-1"],"sourceRawEndN":19,"sourceRawStartN":0,"timestampEndUtc":"2026-03-07T00:00:20\u002B00:00","timestampStartUtc":"2026-03-07T00:00:00\u002B00:00","universeStates":{"cryptic-support":{"bloom":0.4,"drift":-0.1,"pressure":0.2},"prime-projection":{"bloom":0.7,"drift":0.19999999999999998,"pressure":0.325}}},{"artifactId":"f196120c-0fed-4d44-944c-0da60949710a","deltaHorizon":20,"deltaHorizonMs":20000,"n":1,"phaseSliceId":"phase-2","sliceDigest":"3ba58efb800ecaab00a004ac2adceec19060249bc75a6dfc392aed7320ae438e","sourceEventSliceIds":["event-1","event-2"],"sourceRawEndN":29,"sourceRawStartN":10,"timestampEndUtc":"2026-03-07T00:00:30\u002B00:00","timestampStartUtc":"2026-03-07T00:00:10\u002B00:00","universeStates":{"cryptic-support":{"bloom":0.65,"drift":0.19999999999999998,"pressure":0.25},"prime-projection":{"bloom":0.9,"drift":0.04999999999999999,"pressure":0.475}}},{"artifactId":"f196120c-0fed-4d44-944c-0da60949710a","deltaHorizon":20,"deltaHorizonMs":20000,"n":2,"phaseSliceId":"phase-3","sliceDigest":"0858c4e2a131c989888fd708bcafb79f298fec143279cfd57020d047a58da9b5","sourceEventSliceIds":["event-2","event-3"],"sourceRawEndN":39,"sourceRawStartN":20,"timestampEndUtc":"2026-03-07T00:00:40\u002B00:00","timestampStartUtc":"2026-03-07T00:00:20\u002B00:00","universeStates":{"cryptic-support":{"bloom":0.95,"drift":0.35000000000000003,"pressure":0.575},"prime-projection":{"bloom":0.95,"drift":0.35,"pressure":0.56}}}]}