{"artifactId":"e4b06156-a3a2-428c-bafa-bd12fd0be848","schema":"oan.hopng_phase_slice","schemaVersion":"0.1.0","slices":[{"artifactId":"e4b06156-a3a2-428c-bafa-bd12fd0be848","deltaHorizon":20,"deltaHorizonMs":20000,"n":0,"phaseSliceId":"phase-1","sliceDigest":"08c28975513684ac0a05e2dbaba9b37eb4cd9cda8ff925f6549c7ed219f113f3","sourceEventSliceIds":["event-0","event-1"],"sourceRawEndN":19,"sourceRawStartN":0,"timestampEndUtc":"2026-03-07T00:00:20\u002B00:00","timestampStartUtc":"2026-03-07T00:00:00\u002B00:00","universeStates":{"cryptic-support":{"bloom":0.4,"drift":-0.1,"pressure":0.2},"prime-projection":{"bloom":0.7,"drift":0.19999999999999998,"pressure":0.325}}},{"artifactId":"e4b06156-a3a2-428c-bafa-bd12fd0be848","deltaHorizon":20,"deltaHorizonMs":20000,"n":1,"phaseSliceId":"phase-2","sliceDigest":"b810e7987952946ca82c78415584b2d213adc87b338dcf79859e611b9796c6f3","sourceEventSliceIds":["event-1","event-2"],"sourceRawEndN":29,"sourceRawStartN":10,"timestampEndUtc":"2026-03-07T00:00:30\u002B00:00","timestampStartUtc":"2026-03-07T00:00:10\u002B00:00","universeStates":{"cryptic-support":{"bloom":0.65,"drift":0.19999999999999998,"pressure":0.25},"prime-projection":{"bloom":0.9,"drift":0.04999999999999999,"pressure":0.475}}},{"artifactId":"e4b06156-a3a2-428c-bafa-bd12fd0be848","deltaHorizon":20,"deltaHorizonMs":20000,"n":2,"phaseSliceId":"phase-3","sliceDigest":"f34aca0eabffbdde637ff6d5f3381500e4419bd2ccebc6364f5f81c9c226f75d","sourceEventSliceIds":["event-2","event-3"],"sourceRawEndN":39,"sourceRawStartN":20,"timestampEndUtc":"2026-03-07T00:00:40\u002B00:00","timestampStartUtc":"2026-03-07T00:00:20\u002B00:00","universeStates":{"cryptic-support":{"bloom":0.8,"drift":0.10000000000000003,"pressure":0.47500000000000003},"prime-projection":{"bloom":0.6,"drift":-0.19999999999999998,"pressure":0.44}}}]}