{"artifactId":"a543ba2e-9cc4-40aa-a2be-f6215f33c714","schema":"oan.hopng_phase_slice","schemaVersion":"0.1.0","slices":[{"artifactId":"a543ba2e-9cc4-40aa-a2be-f6215f33c714","deltaHorizon":10,"deltaHorizonMs":10000,"n":0,"phaseSliceId":"phase-1","sliceDigest":"824af27d336970c577a725629151c8b901d59e1f7ea8e26c1d47b683ef60e5c8","sourceEventSliceIds":["event-0","event-1"],"sourceRawEndN":19,"sourceRawStartN":0,"timestampEndUtc":"2026-03-07T00:00:20\u002B00:00","timestampStartUtc":"2026-03-07T00:00:00\u002B00:00","universeStates":{"cryptic-support":{"bloom":0.4,"drift":-0.1,"pressure":0.2},"prime-projection":{"bloom":0.7,"drift":0.19999999999999998,"pressure":0.325}}},{"artifactId":"a543ba2e-9cc4-40aa-a2be-f6215f33c714","deltaHorizon":10,"deltaHorizonMs":10000,"n":1,"phaseSliceId":"phase-2","sliceDigest":"c48ba90bbcf010a00606565f5b573c8209e86a32aa0e3aad8c3fbebeca57b228","sourceEventSliceIds":["event-1","event-2"],"sourceRawEndN":29,"sourceRawStartN":10,"timestampEndUtc":"2026-03-07T00:00:30\u002B00:00","timestampStartUtc":"2026-03-07T00:00:10\u002B00:00","universeStates":{"cryptic-support":{"bloom":0.65,"drift":0.19999999999999998,"pressure":0.25},"prime-projection":{"bloom":0.9,"drift":0.04999999999999999,"pressure":0.475}}},{"artifactId":"a543ba2e-9cc4-40aa-a2be-f6215f33c714","deltaHorizon":10,"deltaHorizonMs":10000,"n":2,"phaseSliceId":"phase-3","sliceDigest":"c28fda1bf3699acba00a77ba9e7134376b8c28e90641cfd53500479363418f86","sourceEventSliceIds":["event-2","event-3"],"sourceRawEndN":39,"sourceRawStartN":20,"timestampEndUtc":"2026-03-07T00:00:40\u002B00:00","timestampStartUtc":"2026-03-07T00:00:20\u002B00:00","universeStates":{"cryptic-support":{"bloom":0.8,"drift":0.10000000000000003,"pressure":0.47500000000000003},"prime-projection":{"bloom":0.6,"drift":-0.19999999999999998,"pressure":0.44}}}]}